{
  "hardware_result_version": "1.0",
  "manifest_id": "stage2-example-attn_a_ffn_b",
  "candidate_id": "tp4_shape4_ep2_epshape2_reldisjoint_ar1_fr1",
  "execution_status": "RUNTIME_CONTENDED",
  "observed_placement": [
    {
      "logical_group": "DECODE_ATTN",
      "replica": 0,
      "parallel_rank": 0,
      "host": "hostA",
      "physical_gpu": 1
    },
    {
      "logical_group": "DECODE_ATTN",
      "replica": 0,
      "parallel_rank": 1,
      "host": "hostA",
      "physical_gpu": 2
    },
    {
      "logical_group": "DECODE_ATTN",
      "replica": 0,
      "parallel_rank": 2,
      "host": "hostA",
      "physical_gpu": 3
    },
    {
      "logical_group": "DECODE_ATTN",
      "replica": 0,
      "parallel_rank": 3,
      "host": "hostA",
      "physical_gpu": 4
    },
    {
      "logical_group": "DECODE_FFN",
      "replica": 0,
      "parallel_rank": 0,
      "host": "hostB",
      "physical_gpu": 0
    },
    {
      "logical_group": "DECODE_FFN",
      "replica": 0,
      "parallel_rank": 1,
      "host": "hostB",
      "physical_gpu": 1
    },
    {
      "logical_group": "PREFILL",
      "replica": 0,
      "parallel_rank": 0,
      "host": "hostA",
      "physical_gpu": 0
    }
  ],
  "workload_realization": {
    "requested_regime": "burst",
    "requested_request_count": 8,
    "achieved_request_count": 8,
    "requested_qps": null,
    "achieved_qps": null,
    "scheduling_lag_ms": null
  },
  "occupancy_evidence": {
    "contention_status": "contended",
    "pre_run_occupancy": [],
    "post_run_occupancy": [],
    "in_run_conflicting_process_evidence": [
      "third-party alltoall/RCCL activity observed on hostB during the run (Stage 1B finding 8: a real external-contender failure mode, not this candidate's own configuration being invalid)"
    ],
    "exclusive_run": false,
    "contention_evidence": [
      "nvidia-smi/rocm-smi process list showed a foreign PID with active NCCL/RCCL communicator on hostB:GPU0"
    ]
  },
  "system": {
    "hosts": [
      "hostA",
      "hostB"
    ],
    "gpu_identities": [],
    "runtime_version": "SYNTHETIC-ILLUSTRATIVE-NOT-REAL-HARDWARE",
    "image_digest": null
  },
  "observed_runtime_identity": {
    "engine": "vllm",
    "engine_version": null,
    "model_revision": null,
    "precision": null,
    "quantization": null,
    "transport": "tcp"
  },
  "observed_model_identity": null,
  "metrics": {
    "ttft": {
      "mean": 2.4,
      "median": null,
      "p95": null
    },
    "tpot": {
      "mean": 9.1,
      "median": 8.7,
      "p95": 15.2
    },
    "e2e": {
      "mean": 12.0,
      "median": null,
      "p95": null
    },
    "request_throughput_rps": 24.1,
    "token_throughput_tps": null,
    "slo_attainment": 0.7
  },
  "memory": null,
  "raw_result_paths": [
    "SYNTHETIC-ILLUSTRATIVE-NOT-REAL-HARDWARE/no-file-exists"
  ],
  "provenance": {
    "timestamp_utc": "2026-08-26T00:05:00+00:00",
    "planner_git_sha": null,
    "simulator_git_sha": null,
    "topology_id": null,
    "seed": null
  }
}